{
  "schema_version": "career.job_match.v1",
  "policy_version": "job_match_v1",
  "reference_policy_version": "job_match_deterministic_v2",
  "skill_equivalence_policy_version": "conservative_skill_equivalence_v1",
  "recommendation_policy_version": "job_match_recommendation_v1",
  "recommendation_reference_policy_version": "job_match_recommendation_safety_v1",
  "resume_normalization_policy_version": "resume_normalization_v1",
  "job_normalization_policy_version": "job_normalization_v1",
  "core_version": "0.1.0",
  "resume_document_id": "synthetic-match-resume-complete-v1",
  "job_document_id": "synthetic-match-job-complete-v1",
  "scoring_weights": {
    "skills_match": 30,
    "experience_match": 25,
    "seniority_fit": 15,
    "domain_fit": 10,
    "keyword_alignment": 10,
    "education_fit": 10
  },
  "overall_score": 96,
  "category_scores": {
    "skills_match": 100,
    "experience_match": 100,
    "seniority_fit": 100,
    "domain_fit": 100,
    "keyword_alignment": 65,
    "education_fit": 100
  },
  "category_results": [
    {
      "category": "skills_match",
      "weight": 30,
      "raw_score": 100,
      "score": 100,
      "score_adjusted": false,
      "explanation": "Matched 4/4 required skills and 4/4 preferred skills using normalized exact or reviewed same-technology aliases.",
      "items": [
        {
          "kind": "required_skill",
          "item": "Python",
          "resume_item": "Python",
          "status": "confirmed_match",
          "match_type": "normalized_exact",
          "job_source": {
            "start_line": 8,
            "end_line": 8,
            "excerpt": "- Python, Django, PostgreSQL, REST APIs",
            "transformation": "delimiter_split"
          },
          "resume_source": {
            "start_line": 15,
            "end_line": 15,
            "excerpt": "Python",
            "transformation": "delimiter_split"
          }
        },
        {
          "kind": "required_skill",
          "item": "Django",
          "resume_item": "Django",
          "status": "confirmed_match",
          "match_type": "normalized_exact",
          "job_source": {
            "start_line": 8,
            "end_line": 8,
            "excerpt": "- Python, Django, PostgreSQL, REST APIs",
            "transformation": "delimiter_split"
          },
          "resume_source": {
            "start_line": 15,
            "end_line": 15,
            "excerpt": "Django",
            "transformation": "delimiter_split"
          }
        },
        {
          "kind": "required_skill",
          "item": "PostgreSQL",
          "resume_item": "PostgreSQL",
          "status": "confirmed_match",
          "match_type": "normalized_exact",
          "job_source": {
            "start_line": 8,
            "end_line": 8,
            "excerpt": "- Python, Django, PostgreSQL, REST APIs",
            "transformation": "delimiter_split"
          },
          "resume_source": {
            "start_line": 15,
            "end_line": 15,
            "excerpt": "PostgreSQL",
            "transformation": "delimiter_split"
          }
        },
        {
          "kind": "required_skill",
          "item": "REST APIs",
          "resume_item": "REST APIs",
          "status": "confirmed_match",
          "match_type": "normalized_exact",
          "job_source": {
            "start_line": 8,
            "end_line": 8,
            "excerpt": "- Python, Django, PostgreSQL, REST APIs",
            "transformation": "delimiter_split"
          },
          "resume_source": {
            "start_line": 15,
            "end_line": 15,
            "excerpt": "REST APIs",
            "transformation": "delimiter_split"
          }
        },
        {
          "kind": "preferred_skill",
          "item": "AWS",
          "resume_item": "AWS",
          "status": "confirmed_match",
          "match_type": "normalized_exact",
          "job_source": {
            "start_line": 12,
            "end_line": 12,
            "excerpt": "- AWS, Docker, Kubernetes",
            "transformation": "delimiter_split"
          },
          "resume_source": {
            "start_line": 15,
            "end_line": 15,
            "excerpt": "AWS",
            "transformation": "delimiter_split"
          }
        },
        {
          "kind": "preferred_skill",
          "item": "Docker",
          "resume_item": "Docker",
          "status": "confirmed_match",
          "match_type": "normalized_exact",
          "job_source": {
            "start_line": 12,
            "end_line": 12,
            "excerpt": "- AWS, Docker, Kubernetes",
            "transformation": "delimiter_split"
          },
          "resume_source": {
            "start_line": 15,
            "end_line": 15,
            "excerpt": "Docker",
            "transformation": "delimiter_split"
          }
        },
        {
          "kind": "preferred_skill",
          "item": "Kubernetes",
          "resume_item": "Kubernetes",
          "status": "confirmed_match",
          "match_type": "normalized_exact",
          "job_source": {
            "start_line": 12,
            "end_line": 12,
            "excerpt": "- AWS, Docker, Kubernetes",
            "transformation": "delimiter_split"
          },
          "resume_source": {
            "start_line": 15,
            "end_line": 15,
            "excerpt": "Kubernetes",
            "transformation": "delimiter_split"
          }
        },
        {
          "kind": "preferred_skill",
          "item": "Git",
          "resume_item": "Git",
          "status": "confirmed_match",
          "match_type": "normalized_exact",
          "job_source": {
            "start_line": 13,
            "end_line": 13,
            "excerpt": "- Git",
            "transformation": "delimiter_split"
          },
          "resume_source": {
            "start_line": 15,
            "end_line": 15,
            "excerpt": "Git",
            "transformation": "delimiter_split"
          }
        }
      ],
      "metrics": [
        {
          "metric_id": "resume_skill_count",
          "value": "8"
        },
        {
          "metric_id": "required_skill_count",
          "value": "4"
        },
        {
          "metric_id": "preferred_skill_count",
          "value": "4"
        },
        {
          "metric_id": "required_skill_matches",
          "value": "4"
        },
        {
          "metric_id": "preferred_skill_matches",
          "value": "4"
        },
        {
          "metric_id": "required_skill_raw_score",
          "value": "100"
        },
        {
          "metric_id": "preferred_skill_raw_score",
          "value": "100"
        }
      ]
    },
    {
      "category": "experience_match",
      "weight": 25,
      "raw_score": 100,
      "score": 100,
      "score_adjusted": false,
      "explanation": "The job asks for about 5 years; explicit resume date signals support about 6 years.",
      "items": [
        {
          "kind": "experience",
          "item": "- 5+ years of backend engineering experience",
          "resume_item": "approximately 6 explicit years",
          "status": "confirmed_match",
          "match_type": "derived_signal",
          "job_source": {
            "start_line": 9,
            "end_line": 9,
            "excerpt": "- 5+ years of backend engineering experience",
            "transformation": "verbatim"
          },
          "resume_source": {
            "start_line": 8,
            "end_line": 8,
            "excerpt": "2018 - 2024",
            "transformation": "verbatim"
          }
        }
      ],
      "metrics": [
        {
          "metric_id": "experience_entry_count",
          "value": "1"
        },
        {
          "metric_id": "dated_experience_entry_count",
          "value": "1"
        },
        {
          "metric_id": "required_years",
          "value": "5"
        },
        {
          "metric_id": "estimated_resume_years",
          "value": "6"
        }
      ]
    },
    {
      "category": "seniority_fit",
      "weight": 15,
      "raw_score": 100,
      "score": 100,
      "score_adjusted": false,
      "explanation": "Compared explicit job seniority [senior] with resume seniority [senior].",
      "items": [
        {
          "kind": "seniority",
          "item": "senior",
          "resume_item": "senior",
          "status": "confirmed_match",
          "match_type": "derived_signal",
          "job_source": {
            "start_line": 1,
            "end_line": 1,
            "excerpt": "Senior Backend Engineer",
            "transformation": "normalized_case"
          },
          "resume_source": {
            "start_line": 5,
            "end_line": 5,
            "excerpt": "Senior backend engineer building reliable APIs and cloud platforms.",
            "transformation": "whitespace_joined"
          }
        }
      ],
      "metrics": [
        {
          "metric_id": "job_seniority_signals",
          "value": "senior"
        },
        {
          "metric_id": "resume_seniority_signals",
          "value": "senior"
        }
      ]
    },
    {
      "category": "domain_fit",
      "weight": 10,
      "raw_score": 100,
      "score": 100,
      "score_adjusted": false,
      "explanation": "Matched 3/3 bounded lexical job-domain signals.",
      "items": [
        {
          "kind": "domain",
          "item": "backend",
          "resume_item": "backend",
          "status": "confirmed_match",
          "match_type": "derived_signal",
          "job_source": null,
          "resume_source": null
        },
        {
          "kind": "domain",
          "item": "data",
          "resume_item": "data",
          "status": "confirmed_match",
          "match_type": "derived_signal",
          "job_source": null,
          "resume_source": null
        },
        {
          "kind": "domain",
          "item": "devops_cloud",